{
  "prompt_id": "RF-CRITIQUE-1.0",
  "figure_id": "claimcrawl-fig-1",
  "verdict": "pending",
  "reader_inferences": [],
  "visible_inventory": {
    "panels": [],
    "components": [],
    "relations": [],
    "required_text": [],
    "numeric_marks": []
  },
  "expected_inventory": {
    "panels": [
      "A",
      "B",
      "C"
    ],
    "claims": [
      "C1",
      "C2"
    ],
    "required_text": [
      "Retrieval visibility",
      "Selection behavior",
      "Coverage state",
      "Failure not localized"
    ],
    "critical_checks": [
      "the three regions are not connected as a pipeline",
      "no benchmark value or causal performance claim appears",
      "all required labels are exact",
      "the illustrative scope is visible"
    ]
  },
  "scores": {
    "scientific_fidelity": null,
    "structural_correctness": null,
    "role_purity": null,
    "message_clarity": null,
    "readability": null,
    "accessibility": null,
    "editability_reproducibility": null
  },
  "critical_failures": [],
  "major_issues": [],
  "minor_issues": [],
  "revision_deltas": [],
  "unresolved_evidence": [],
  "new_issues_vs_prior": []
}
